### ISSUE TITLE
WebDAV HTTP status 405

### ISSUE THREAD

**Issue by cenuh** [keeweb/keeweb#580]
Hello,

i wanted to selfhosting my pw file. So i decided to use WebDAV. But when i'm trying to sync KeeWeb it says "HTTP status 405" ? I followed your intrsuction on the keeweb wiki.

here is my apache .conf:

```
<VirtualHost *:80>
    ServerAdmin bob@server.local
    ServerName webdav.server.local

    DocumentRoot /var/www/webdav

    DavLockDB "/var/www/davLock/LockDB"

    Header always set Access-Control-Allow-Origin "*"
    Header always set Access-Control-Allow-Headers "origin, content-type, cache-control, accept, authorization, if-match, destination, overwrite"
    Header always set Access-Control-Expose-Headers "ETag"
    Header always set Access-Control-Allow-Methods "GET, HEAD, POST, PUT, OPTIONS, MOVE, DELETE, COPY, LOCK, UNLOCK"
    Header always set Access-Control-Allow-Credentials "true"

    RewriteEngine on
    RewriteCond %{REQUEST_METHOD} OPTIONS
    RewriteRule ^(.*)$ blank.html [R=200,L,E=HTTP_ORIGIN:%{HTTP:ORIGIN}]

    <Directory "/var/www/html/webdav">
        Options -FollowSymLinks
        AllowOverride All
        DAV on
        AuthType Basic
        AuthName "webdav"
        AuthUserfile /etc/apache2/.htpasswd
        Require valid-user
    </Directory>
</VirtualHost>
```

Is something wrong with this?

my setup is KeeWeb v1.4.1 on Windows10

**Thanks!** and keep up the good work!

btw, is there an option to use KeeWeb offline on Android?

**Comment by antelle** [comment]
Please paste a request which gives you 405 error.

**Comment by cenuh** [comment]
Im not exaclty sure what you mean with 'a request' ?

here is what apache says:

```
79.199.124.69 - - [02/Apr/2017:00:50:50 +0200] "HEAD /webdav/lolwat.kdbx HTTP/1.1" 304 181 "-" "Mozilla/5.0 (Windows NT 10.0; Win64; x64) AppleWebKit/537.36 (KHTML, like Gecko) KeeWeb/1.4.1 Chrome/53.0.2785.143 Electron/1.4.15 Safari/537.36"
79.199.124.69 - - [02/Apr/2017:00:50:50 +0200] "HEAD /webdav/lolwat.kdbx HTTP/1.1" 304 180 "-" "Mozilla/5.0 (Windows NT 10.0; Win64; x64) AppleWebKit/537.36 (KHTML, like Gecko) KeeWeb/1.4.1 Chrome/53.0.2785.143 Electron/1.4.15 Safari/537.36"
79.199.124.69 - - [02/Apr/2017:00:50:50 +0200] "PUT /webdav/.lolwat.kdbx.1491087050585 HTTP/1.1" 405 588 "-" "Mozilla/5.0 (Windows NT 10.0; Win64; x64) AppleWebKit/537.36 (KHTML, like Gecko) KeeWeb/1.4.1 Chrome/53.0.2785.143 Electron/1.4.15 Safari/537.36"
```

and this is what keeweb says:
( i'm not really sure what information is relevant, so i post all of it, hope this is ok)

```
28	00:42:09 02.04.2017	19.1912745	KeeWeb.exe	PHREAK  	92.222.105.56	TCP	TCP:Flags=......S., SrcPort=1575, DstPort=HTTP(80), PayloadLen=0, Seq=3968436721, Ack=0, Win=8192 ( Negotiating scale factor 0x8 ) = 8192	{TCP:22, IPv4:21}
29	00:42:09 02.04.2017	19.2230632	KeeWeb.exe	92.222.105.56	PHREAK  	TCP	TCP:Flags=...A..S., SrcPort=HTTP(80), DstPort=1575, PayloadLen=0, Seq=669390971, Ack=3968436722, Win=29200 ( Negotiated scale factor 0x7 ) = 3737600	{TCP:22, IPv4:21}
30	00:42:09 02.04.2017	19.2231319	KeeWeb.exe	PHREAK  	92.222.105.56	TCP	TCP:Flags=...A...., SrcPort=1575, DstPort=HTTP(80), PayloadLen=0, Seq=3968436722, Ack=669390972, Win=260 (scale factor 0x8) = 66560	{TCP:22, IPv4:21}
31	00:42:09 02.04.2017	19.2283464	KeeWeb.exe	PHREAK  	92.222.105.56	HTTP	HTTP:Request, HEAD /webdav/lolwat.kdbx , Using Basic Authorization	{HTTP:23, TCP:22, IPv4:21}
32	00:42:09 02.04.2017	19.2610986	KeeWeb.exe	92.222.105.56	PHREAK  	TCP	TCP:Flags=...A...., SrcPort=HTTP(80), DstPort=1575, PayloadLen=0, Seq=669390972, Ack=3968437096, Win=237 (scale factor 0x7) = 30336	{TCP:22, IPv4:21}
33	00:42:09 02.04.2017	19.2610986	KeeWeb.exe	92.222.105.56	PHREAK  	HTTP	HTTP:Response, HTTP/1.1, Status: Ok, URL: /webdav/lolwat.kdbx 	{HTTP:23, TCP:22, IPv4:21}
34	00:42:09 02.04.2017	19.3116076	KeeWeb.exe	PHREAK  	92.222.105.56	TCP	TCP:Flags=...A...., SrcPort=1575, DstPort=HTTP(80), PayloadLen=0, Seq=3968437096, Ack=669391233, Win=259 (scale factor 0x8) = 66304	{TCP:22, IPv4:21}
35	00:42:09 02.04.2017	19.3132730	KeeWeb.exe	PHREAK  	92.222.105.56	HTTP	HTTP:Request, HEAD /webdav/lolwat.kdbx , Using Basic Authorization	{HTTP:23, TCP:22, IPv4:21}
36	00:42:09 02.04.2017	19.3450763	KeeWeb.exe	92.222.105.56	PHREAK  	HTTP	HTTP:Response, HTTP/1.1, Status: Not modified, URL: /webdav/lolwat.kdbx 	{HTTP:23, TCP:22, IPv4:21}
37	00:42:09 02.04.2017	19.3546028	KeeWeb.exe	PHREAK  	92.222.105.56	HTTP	HTTP:Request, PUT /webdav/.lolwat.kdbx.1491086529905 , Using Basic Authorization	{HTTP:23, TCP:22, IPv4:21}
38	00:42:09 02.04.2017	19.3546297	KeeWeb.exe	PHREAK  	92.222.105.56	HTTP	HTTP:HTTP Payload, URL: /webdav/.lolwat.kdbx.1491086529905 	{HTTP:23, TCP:22, IPv4:21}
39	00:42:09 02.04.2017	19.3874799	KeeWeb.exe	92.222.105.56	PHREAK  	TCP	TCP:Flags=...A...., SrcPort=HTTP(80), DstPort=1575, PayloadLen=0, Seq=669391413, Ack=3968439676, Win=280 (scale factor 0x7) = 35840	{TCP:22, IPv4:21}
40	00:42:09 02.04.2017	19.3883351	KeeWeb.exe	92.222.105.56	PHREAK  	HTTP	HTTP:Response, HTTP/1.1, Status: Method not allowed, URL: /webdav/.lolwat.kdbx.1491086529905 	{HTTP:23, TCP:22, IPv4:21}
41	00:42:10 02.04.2017	19.4385988	KeeWeb.exe	PHREAK  	92.222.105.56	TCP	TCP:Flags=...A...., SrcPort=1575, DstPort=HTTP(80), PayloadLen=0, Seq=3968439676, Ack=669392001, Win=256 (scale factor 0x8) = 65536	{TCP:22, IPv4:21}
49	00:42:14 02.04.2017	24.2926054	KeeWeb.exe	92.222.105.56	PHREAK  	TCP	TCP:Flags=...A...F, SrcPort=HTTP(80), DstPort=1575, PayloadLen=0, Seq=669392001, Ack=3968439676, Win=280 (scale factor 0x7) = 35840	{TCP:22, IPv4:21}
50	00:42:14 02.04.2017	24.2926552	KeeWeb.exe	PHREAK  	92.222.105.56	TCP	TCP:Flags=...A...., SrcPort=1575, DstPort=HTTP(80), PayloadLen=0, Seq=3968439676, Ack=669392002, Win=256 (scale factor 0x8) = 65536	{TCP:22, IPv4:21}
81	00:42:24 02.04.2017	33.4800315	KeeWeb.exe	PHREAK  	92.222.105.56	TCP	TCP:Flags=...A...F, SrcPort=1575, DstPort=HTTP(80), PayloadLen=0, Seq=3968439676, Ack=669392002, Win=256 (scale factor 0x8) = 65536	{TCP:22, IPv4:21}
82	00:42:24 02.04.2017	33.4802422	KeeWeb.exe	PHREAK  	92.222.105.56	TCP	TCP:Flags=......S., SrcPort=1576, DstPort=HTTP(80), PayloadLen=0, Seq=138332907, Ack=0, Win=8192 ( Negotiating scale factor 0x8 ) = 8192	{TCP:44, IPv4:21}
83	00:42:24 02.04.2017	33.5113502	KeeWeb.exe	92.222.105.56	PHREAK  	TCP	TCP:Flags=...A...., SrcPort=HTTP(80), DstPort=1575, PayloadLen=0, Seq=669392002, Ack=3968439677, Win=280 (scale factor 0x7) = 35840	{TCP:22, IPv4:21}
84	00:42:24 02.04.2017	33.5121237	KeeWeb.exe	92.222.105.56	PHREAK  	TCP	TCP:Flags=...A..S., SrcPort=HTTP(80), DstPort=1576, PayloadLen=0, Seq=1715327966, Ack=138332908, Win=29200 ( Negotiated scale factor 0x7 ) = 3737600	{TCP:44, IPv4:21}
85	00:42:24 02.04.2017	33.5121828	KeeWeb.exe	PHREAK  	92.222.105.56	TCP	TCP:Flags=...A...., SrcPort=1576, DstPort=HTTP(80), PayloadLen=0, Seq=138332908, Ack=1715327967, Win=260 (scale factor 0x8) = 66560	{TCP:44, IPv4:21}
86	00:42:24 02.04.2017	33.5123375	KeeWeb.exe	PHREAK  	92.222.105.56	HTTP	HTTP:Request, HEAD /webdav/lolwat.kdbx , Using Basic Authorization	{HTTP:45, TCP:44, IPv4:21}
87	00:42:24 02.04.2017	33.5441766	KeeWeb.exe	92.222.105.56	PHREAK  	TCP	TCP:Flags=...A...., SrcPort=HTTP(80), DstPort=1576, PayloadLen=0, Seq=1715327967, Ack=138333368, Win=237 (scale factor 0x7) = 30336	{TCP:44, IPv4:21}
88	00:42:24 02.04.2017	33.5441766	KeeWeb.exe	92.222.105.56	PHREAK  	HTTP	HTTP:Response, HTTP/1.1, Status: Not modified, URL: /webdav/lolwat.kdbx 	{HTTP:45, TCP:44, IPv4:21}
89	00:42:24 02.04.2017	33.5672507	KeeWeb.exe	PHREAK  	92.222.105.56	HTTP	HTTP:Request, HEAD /webdav/lolwat.kdbx , Using Basic Authorization	{HTTP:45, TCP:44, IPv4:21}
90	00:42:24 02.04.2017	33.5993838	KeeWeb.exe	92.222.105.56	PHREAK  	HTTP	HTTP:Response, HTTP/1.1, Status: Not modified, URL: /webdav/lolwat.kdbx 	{HTTP:45, TCP:44, IPv4:21}
91	00:42:24 02.04.2017	33.6012581	KeeWeb.exe	PHREAK  	92.222.105.56	HTTP	HTTP:Request, PUT /webdav/.lolwat.kdbx.1491086544168 , Using Basic Authorization	{HTTP:45, TCP:44, IPv4:21}
92	00:42:24 02.04.2017	33.6012834	KeeWeb.exe	PHREAK  	92.222.105.56	HTTP	HTTP:HTTP Payload, URL: /webdav/.lolwat.kdbx.1491086544168 	{HTTP:45, TCP:44, IPv4:21}
93	00:42:24 02.04.2017	33.6342478	KeeWeb.exe	92.222.105.56	PHREAK  	TCP	TCP:Flags=...A...., SrcPort=HTTP(80), DstPort=1576, PayloadLen=0, Seq=1715328328, Ack=138335722, Win=277 (scale factor 0x7) = 35456	{TCP:44, IPv4:21}
94	00:42:24 02.04.2017	33.6351556	KeeWeb.exe	92.222.105.56	PHREAK  	HTTP	HTTP:Response, HTTP/1.1, Status: Method not allowed, URL: /webdav/.lolwat.kdbx.1491086544168 	{HTTP:45, TCP:44, IPv4:21}
95	00:42:24 02.04.2017	33.6853695	KeeWeb.exe	PHREAK  	92.222.105.56	TCP	TCP:Flags=...A...., SrcPort=1576, DstPort=HTTP(80), PayloadLen=0, Seq=138335948, Ack=1715328916, Win=257 (scale factor 0x8) = 65792	{TCP:44, IPv4:21}
98	00:42:25 02.04.2017	34.4623253	KeeWeb.exe	PHREAK  	92.222.105.56	HTTP	HTTP:Request, HEAD /webdav/lolwat.kdbx , Using Basic Authorization	{HTTP:45, TCP:44, IPv4:21}
99	00:42:25 02.04.2017	34.4942032	KeeWeb.exe	92.222.105.56	PHREAK  	HTTP	HTTP:Response, HTTP/1.1, Status: Not modified, URL: /webdav/lolwat.kdbx 	{HTTP:45, TCP:44, IPv4:21}
100	00:42:25 02.04.2017	34.5130476	KeeWeb.exe	PHREAK  	92.222.105.56	HTTP	HTTP:Request, HEAD /webdav/lolwat.kdbx , Using Basic Authorization	{HTTP:45, TCP:44, IPv4:21}
101	00:42:25 02.04.2017	34.5450055	KeeWeb.exe	92.222.105.56	PHREAK  	HTTP	HTTP:Response, HTTP/1.1, Status: Not modified, URL: /webdav/lolwat.kdbx 	{HTTP:45, TCP:44, IPv4:21}
102	00:42:25 02.04.2017	34.5471725	KeeWeb.exe	PHREAK  	92.222.105.56	HTTP	HTTP:Request, PUT /webdav/.lolwat.kdbx.1491086545113 , Using Basic Authorization	{HTTP:45, TCP:44, IPv4:21}
103	00:42:25 02.04.2017	34.5472022	KeeWeb.exe	PHREAK  	92.222.105.56	HTTP	HTTP:HTTP Payload, URL: /webdav/.lolwat.kdbx.1491086545113 	{HTTP:45, TCP:44, IPv4:21}
104	00:42:25 02.04.2017	34.5801867	KeeWeb.exe	92.222.105.56	PHREAK  	TCP	TCP:Flags=...A...., SrcPort=HTTP(80), DstPort=1576, PayloadLen=0, Seq=1715329276, Ack=138338988, Win=394 (scale factor 0x7) = 50432	{TCP:44, IPv4:21}
105	00:42:25 02.04.2017	34.5809493	KeeWeb.exe	92.222.105.56	PHREAK  	HTTP	HTTP:Response, HTTP/1.1, Status: Method not allowed, URL: /webdav/.lolwat.kdbx.1491086545113 	{HTTP:45, TCP:44, IPv4:21}
106	00:42:25 02.04.2017	34.6314578	KeeWeb.exe	PHREAK  	92.222.105.56	TCP	TCP:Flags=...A...., SrcPort=1576, DstPort=HTTP(80), PayloadLen=0, Seq=138338988, Ack=1715329864, Win=260 (scale factor 0x8) = 66560	{TCP:44, IPv4:21}
172	00:42:30 02.04.2017	39.5091836	KeeWeb.exe	92.222.105.56	PHREAK  	TCP	TCP:Flags=...A...F, SrcPort=HTTP(80), DstPort=1576, PayloadLen=0, Seq=1715329864, Ack=138338988, Win=394 (scale factor 0x7) = 50432	{TCP:44, IPv4:21}
173	00:42:30 02.04.2017	39.5092433	KeeWeb.exe	PHREAK  	92.222.105.56	TCP	TCP:Flags=...A...., SrcPort=1576, DstPort=HTTP(80), PayloadLen=0, Seq=138338988, Ack=1715329865, Win=260 (scale factor 0x8) = 66560	{TCP:44, IPv4:21}
```

I hope this is the information you need?

thanks!

**Comment by antelle** [comment]
This is the request which gives you 405:
79.199.124.69 - - [02/Apr/2017:00:50:50 +0200] "PUT /webdav/.lolwat.kdbx.1491087050585 HTTP/1.1" 405

Please fix it on your Apache, then test again.
It looks like webdav is not allowed, but I don't know.

**Comment by cenuh** [comment]
I fixed my apache, the problem were ( after many hours of searching .. ) I just used the wrong AuthType.
"Basic" is for SSL and "Digest" for normal http. 
It is working now, but only if i am completly deactivate the login from webdav.
The problem is here, i can acces my webDAV perfect from window explorer or browser, i can tip in the login details and it is working. Just Keeweb says "HTTP 401" when im trying to load the file from my webDAV. But the login details are 100% correct.

**Comment by Vagrantin** [comment]
@cenuh did you manage to fix the authentication issue ?
I'm also experiencing this with this setup

Apache 2.4
Authentication basic over ssl

It's working properly with web browsers and Webdav apps, but with Keeweb it's only working when authentication is disable using ``Require all granted`` for all method.

Matth
